[
  {
    "name": "Corner Table",
    "id": "corner_table",
    "category": "living_room",
    "subcategory": "tables",
    "tags": [
      "compact",
      "wood",
      "simple",
      "corner"
    ],
    "origin": {
      "type": "front_left_bottom",
      "facing": "north"
    },
    "bounds": {
      "width": 1,
      "height": 2,
      "depth": 1
    },
    "placements": [
      {
        "type": "block",
        "pos": {
          "x": 0,
          "y": 0,
          "z": 0
        },
        "block": "oak_fence",
        "state": "[axis=y]"
      },
      {
        "type": "block",
        "pos": {
          "x": 0,
          "y": 1,
          "z": 0
        },
        "block": "oak_pressure_plate"
      }
    ],
    "materials": {
      "oak_fence": 1,
      "oak_pressure_plate": 1
    },
    "clearance": {
      "front": 1,
      "back": 0,
      "left": 0,
      "right": 0,
      "top": 1
    },
    "notes": "Compact 1-block corner table. Perfect for room corners or small spaces. Can be made with any wood type (oak, spruce, birch, jungle, acacia, dark_oak, mangrove, cherry, bamboo). Alternatively, use carpet or trapdoor on top instead of pressure plate.",
    "variants": [
      {
        "name": "Corner Table (Trapdoor)",
        "id": "corner_table_trapdoor",
        "changes": "Uses trapdoor instead of pressure plate for a solid top",
        "material_overrides": {
          "oak_pressure_plate": "oak_trapdoor"
        }
      }
    ],
    "source": {
      "type": "minecraft_wiki",
      "url": "https://minecraft.wiki/w/Tutorials/Furniture"
    }
  },
  {
    "name": "Simple Dining Table",
    "id": "simple_dining_table",
    "category": "living_room",
    "subcategory": "tables",
    "tags": [
      "wood",
      "dining",
      "medium"
    ],
    "origin": {
      "type": "front_left_bottom",
      "facing": "north"
    },
    "bounds": {
      "width": 3,
      "height": 2,
      "depth": 2
    },
    "placements": [
      {
        "type": "block",
        "pos": {
          "x": 0,
          "y": 0,
          "z": 0
        },
        "block": "oak_fence",
        "state": "[axis=y]"
      },
      {
        "type": "block",
        "pos": {
          "x": 2,
          "y": 0,
          "z": 0
        },
        "block": "oak_fence",
        "state": "[axis=y]"
      },
      {
        "type": "block",
        "pos": {
          "x": 0,
          "y": 0,
          "z": 1
        },
        "block": "oak_fence",
        "state": "[axis=y]"
      },
      {
        "type": "block",
        "pos": {
          "x": 2,
          "y": 0,
          "z": 1
        },
        "block": "oak_fence",
        "state": "[axis=y]"
      },
      {
        "type": "fill",
        "from": {
          "x": 0,
          "y": 1,
          "z": 0
        },
        "to": {
          "x": 2,
          "y": 1,
          "z": 1
        },
        "block": "oak_pressure_plate"
      }
    ],
    "materials": {
      "oak_fence": 4,
      "oak_pressure_plate": 6
    },
    "clearance": {
      "front": 1,
      "back": 1,
      "left": 1,
      "right": 1,
      "top": 2
    },
    "notes": "Classic dining table design using fence posts as legs and pressure plates as tabletop. The pressure plates allow players to walk through the table area. Works well with 4 chairs around it (1 on each side).",
    "source": {
      "type": "minecraft_wiki",
      "url": "https://minecraft.wiki/w/Tutorials/Furniture"
    }
  },
  {
    "name": "Wall Cabinet",
    "id": "wall_cabinet",
    "category": "kitchen",
    "subcategory": "storage",
    "tags": [
      "storage",
      "wall",
      "compact"
    ],
    "origin": {
      "type": "front_left_bottom",
      "facing": "north"
    },
    "bounds": {
      "width": 1,
      "height": 2,
      "depth": 1
    },
    "placements": [
      {
        "type": "block",
        "pos": {
          "x": 0,
          "y": 0,
          "z": 0
        },
        "block": "bookshelf"
      },
      {
        "type": "block",
        "pos": {
          "x": 0,
          "y": 1,
          "z": 0
        },
        "block": "oak_trapdoor",
        "state": "[facing=north,half=top,open=false]"
      },
      {
        "type": "block",
        "pos": {
          "x": 0,
          "y": 0,
          "z": 0
        },
        "block": "bookshelf"
      }
    ],
    "materials": {
      "bookshelf": 1,
      "oak_trapdoor": 2
    },
    "clearance": {
      "front": 1,
      "back": 0,
      "left": 0,
      "right": 0,
      "top": 0
    },
    "notes": "Simple wall-mounted cabinet. Place against a wall (Z=0 should be flush with wall). Bookshelf gives the illusion of items inside. Trapdoors act as cabinet doors. Can be placed in series for a larger cabinet. For kitchen use, consider using stone/concrete blocks instead of bookshelf.",
    "variants": [
      {
        "name": "Kitchen Cabinet",
        "id": "kitchen_cabinet",
        "changes": "Uses smooth stone instead of bookshelf for modern kitchen look",
        "material_overrides": {
          "bookshelf": "smooth_stone"
        }
      }
    ],
    "source": {
      "type": "minecraft_wiki",
      "url": "https://minecraft.wiki/w/Tutorials/Furniture"
    }
  },
  {
    "name": "Simple Chair",
    "id": "simple_chair",
    "category": "living_room",
    "subcategory": "seating",
    "tags": [
      "seating",
      "compact",
      "wood"
    ],
    "origin": {
      "type": "front_left_bottom",
      "facing": "north"
    },
    "bounds": {
      "width": 1,
      "height": 1,
      "depth": 1
    },
    "placements": [
      {
        "type": "block",
        "pos": {
          "x": 0,
          "y": 0,
          "z": 0
        },
        "block": "oak_stairs",
        "state": "[facing=north,half=bottom]"
      }
    ],
    "materials": {
      "oak_stairs": 1
    },
    "clearance": {
      "front": 1,
      "back": 0,
      "left": 0,
      "right": 0,
      "top": 1
    },
    "notes": "Most basic chair design using a single stair block. Facing direction determines which way the chair faces (player would sit facing that direction). Commonly used around tables. For armchairs, add fence posts or signs on the sides.",
    "source": {
      "type": "minecraft_wiki",
      "url": "https://minecraft.wiki/w/Tutorials/Furniture"
    }
  },
  {
    "name": "Floor Lamp (Fence)",
    "id": "floor_lamp_fence",
    "category": "living_room",
    "subcategory": "lighting",
    "tags": [
      "lighting",
      "tall",
      "compact"
    ],
    "origin": {
      "type": "front_left_bottom",
      "facing": "north"
    },
    "bounds": {
      "width": 1,
      "height": 3,
      "depth": 1
    },
    "placements": [
      {
        "type": "block",
        "pos": {
          "x": 0,
          "y": 0,
          "z": 0
        },
        "block": "oak_fence",
        "state": "[axis=y]"
      },
      {
        "type": "block",
        "pos": {
          "x": 0,
          "y": 1,
          "z": 0
        },
        "block": "oak_fence",
        "state": "[axis=y]"
      },
      {
        "type": "block",
        "pos": {
          "x": 0,
          "y": 2,
          "z": 0
        },
        "block": "torch"
      }
    ],
    "materials": {
      "oak_fence": 2,
      "torch": 1
    },
    "clearance": {
      "front": 0,
      "back": 0,
      "left": 0,
      "right": 0,
      "top": 1
    },
    "notes": "Classic floor lamp using fence post as stand and torch as light source. Can use glowstone, sea lantern, or end rod instead of torch for different lighting effects. Light level 14 from torch (sufficient to prevent mob spawning).",
    "variants": [
      {
        "name": "Floor Lamp (Glowstone)",
        "id": "floor_lamp_glowstone",
        "changes": "Uses glowstone block instead of torch for modern look",
        "material_overrides": {
          "torch": "glowstone"
        }
      },
      {
        "name": "Floor Lamp (End Rod)",
        "id": "floor_lamp_endrod",
        "changes": "Uses end rod for sleek modern aesthetic",
        "material_overrides": {
          "oak_fence": "end_rod",
          "torch": "end_rod"
        }
      }
    ],
    "source": {
      "type": "minecraft_wiki",
      "url": "https://minecraft.wiki/w/Tutorials/Furniture"
    }
  },
  {
    "name": "Coffee Table",
    "id": "coffee_table",
    "category": "living_room",
    "subcategory": "tables",
    "tags": [
      "low",
      "compact",
      "modern"
    ],
    "origin": {
      "type": "front_left_bottom",
      "facing": "north"
    },
    "bounds": {
      "width": 2,
      "height": 1,
      "depth": 1
    },
    "placements": [
      {
        "type": "fill",
        "from": {
          "x": 0,
          "y": 0,
          "z": 0
        },
        "to": {
          "x": 1,
          "y": 0,
          "z": 0
        },
        "block": "oak_slab",
        "state": "[type=bottom]"
      }
    ],
    "materials": {
      "oak_slab": 2
    },
    "clearance": {
      "front": 1,
      "back": 1,
      "left": 1,
      "right": 1,
      "top": 2
    },
    "notes": "Low coffee table using slabs. Place near sofas or seating areas. Can be extended to any size by adding more slabs. For decoration, add flower pots (as mugs) or sea pickles on top. Very compact and doesn't block movement.",
    "source": {
      "type": "minecraft_wiki",
      "url": "https://minecraft.wiki/w/Tutorials/Furniture"
    }
  },
  {
    "name": "Closet",
    "id": "simple_closet",
    "category": "bedroom",
    "subcategory": "storage",
    "tags": [
      "storage",
      "interactive",
      "medium"
    ],
    "origin": {
      "type": "front_left_bottom",
      "facing": "north"
    },
    "bounds": {
      "width": 2,
      "height": 3,
      "depth": 1
    },
    "placements": [
      {
        "type": "block",
        "pos": {
          "x": 0,
          "y": 0,
          "z": 0
        },
        "block": "oak_stairs",
        "state": "[facing=east,half=bottom]"
      },